result_type	original_text	perturbed_text	original_output	perturbed_output
Failed	combining quick-cut editing and a blaring heavy metal much of the time , beck seems to be under the illusion that he 's shooting the latest system of a down video .	combining quick-cut editing and a blaring heavy metal much of the time , beck seems to be under the illusion that he 's shooting the latest system of a down video .	0	0
Failed	there 's no emotional pulse to solaris .	there 's no emotional pulse to solaris .	0	0
Successful	the best that can be said about the work here of scottish director ritchie ... is that he obviously does n't have his heart in it .	it is true that there is no heart in the director of Scotland's Scottish director, and that is why it is a great job for him.	0	1
Successful	does paint some memorable images ... , but makhmalbaf keeps her distance from the characters	she has a great memory...... but the makhmalbaf will keep her out of the character	1	0
Failed	rare birds has more than enough charm to make it memorable .	rare birds has more than enough charm to make it memorable .	1	1
Successful	generally , clockstoppers will fulfill your wildest fantasies about being a different kind of time traveler , while happily killing 94 minutes .	generally, the time traveler's most extreme fantasies of being a different time traveler, while they kill 94 minutes.	1	0
Failed	dull , lifeless , and amateurishly assembled .	dull , lifeless , and amateurishly assembled .	0	0
Successful	the quality of the art combined with the humor and intelligence of the script allow the filmmakers to present the biblical message of forgiveness without it ever becoming preachy or syrupy .	the filmmakers, who want to present the Biblical message of forgiveness, need not have the script's quality and humor to do it.	1	0
Failed	very bad .	very bad .	0	0
Failed	having had the good sense to cast actors who are , generally speaking , adored by the movie-going public , khouri then gets terrific performances from them all .	having had the good sense to cast actors who are , generally speaking , adored by the movie-going public , khouri then gets terrific performances from them all .	1	1
Successful	a woman 's pic directed with resonance by ilya chaiken .	pictures of a woman's photo on the device by Ilya Chaiken.	1	0
Successful	mr. tsai is a very original artist in his medium , and what time is it there ?	Mr. Tsai is a master of his medium, and what time is it?	1	0
Successful	for each chuckle there are at least 10 complete misses , many coming from the amazingly lifelike tara reid , whose acting skills are comparable to a cardboard cutout .	at least 10 of the complete misses are for each laugh, which is a total of about 10 times, and many more are remarkably realistic, with a similar performance to a plastic doll.	0	1
Successful	a by-the-numbers patient\/doctor pic that covers all the usual ground	a patient / doctor / hospital picture that covers all of the usual area	0	1
Failed	a lackluster , unessential sequel to the classic disney adaptation of j.m. barrie 's peter pan .	a lackluster , unessential sequel to the classic disney adaptation of j.m. barrie 's peter pan .	0	0
Failed	why make a documentary about these marginal historical figures ?	why make a documentary about these marginal historical figures ?	0	0
Failed	burns never really harnesses to full effect the energetic cast .	burns never really harnesses to full effect the energetic cast .	0	0
Successful	oh come on .	come on, man, it's going to	0	1
Successful	even with a green mohawk and a sheet of fire-red flame tattoos covering his shoulder , however , kilmer seems to be posing , rather than acting .	Kilmer seems to be preparing, rather than acting, even with the green and red fire on his shoulder.	0	1
Successful	its well of thorn and vinegar -lrb- and simple humanity -rrb- has long been plundered by similar works featuring the insight and punch this picture so conspicuously lacks .	similar to the flaw in the picture, the naive and purely human element of this picture is well stolen by similar operations that feature the intuitive and elegant form of this picture.	0	1
Successful	the notion that bombing buildings is the funniest thing in the world goes entirely unexamined in this startlingly unfunny comedy .	in this hilarious comedy, it's completely unserious, the idea that bombs are the best thing in the world.	0	1
Failed	at its worst , it implodes in a series of very bad special effects .	at its worst , it implodes in a series of very bad special effects .	0	0
Failed	and the lesson , in the end , is nothing new .	and the lesson , in the end , is nothing new .	0	0
Successful	... plays like somebody spliced random moments of a chris rock routine into what is otherwise a cliche-riddled but self-serious spy thriller .	it's a classic spy movie, but it's a great role-playing scene of random moments from a popular movie about the CIA.	0	1
Failed	a misogynistic piece of filth that attempts to pass itself off as hip , young adult entertainment .	a misogynistic piece of filth that attempts to pass itself off as hip , young adult entertainment .	0	0
Successful	slick piece of cross-promotion .	a cross-promotion of junk.	1	0
Failed	sade is an engaging look at the controversial eponymous and fiercely atheistic hero .	sade is an engaging look at the controversial eponymous and fiercely atheistic hero .	1	1
Failed	deliriously funny , fast and loose , accessible to the uninitiated , and full of surprises	deliriously funny , fast and loose , accessible to the uninitiated , and full of surprises	1	1
Failed	a literate presentation that wonderfully weaves a murderous event in 1873 with murderous rage in 2002 .	a literate presentation that wonderfully weaves a murderous event in 1873 with murderous rage in 2002 .	1	1
Failed	for the first time in years , de niro digs deep emotionally , perhaps because he 's been stirred by the powerful work of his co-stars .	for the first time in years , de niro digs deep emotionally , perhaps because he 's been stirred by the powerful work of his co-stars .	1	1
Failed	birthday girl is an amusing joy ride , with some surprisingly violent moments .	birthday girl is an amusing joy ride , with some surprisingly violent moments .	1	1
Failed	a tender , witty , captivating film about friendship , love , memory , trust and loyalty .	a tender , witty , captivating film about friendship , love , memory , trust and loyalty .	1	1
Successful	while its careful pace and seemingly opaque story may not satisfy every moviegoer 's appetite , the film 's final scene is soaringly , transparently moving .	the film's last scene, which has been subject to an unusually fast pace and confusingly clear story, may not satisfy all viewers, but it's too high-flying and transparent.	1	0
Successful	... turns so unforgivably trite in its last 10 minutes that anyone without a fortified sweet tooth will likely go into sugar shock .	in ten minutes, the whole thing is turned into a complete and utterly unvarnished - and for those who don't have a sweet tooth - a source	0	1
Failed	excessive , profane , packed with cartoonish violence and comic-strip characters .	excessive , profane , packed with cartoonish violence and comic-strip characters .	0	0
Successful	if you 're hard up for raunchy college humor , this is your ticket right here .	if you're on a trip to the freaks of college humor, this is the place.	1	0
Successful	davis ... is so enamored of her own creation that she ca n't see how insufferable the character is .	she's so enamored of her creation that she can't see how utterly ridiculous the character is.	0	1
Successful	it 's great escapist fun that recreates a place and time that will never happen again .	it's a great escapist fantasy that will only be the same.	1	0
Failed	dazzles with its fully-written characters , its determined stylishness -lrb- which always relates to characters and story -rrb- and johnny dankworth 's best soundtrack in years .	dazzles with its fully-written characters , its determined stylishness -lrb- which always relates to characters and story -rrb- and johnny dankworth 's best soundtrack in years .	1	1
Successful	highbrow self-appointed guardians of culture need not apply , but those who loved cool as ice have at last found a worthy follow-up .	no matter how he likes it, the culture he likes, he will finally find a worthy successor.	1	0
Successful	once -lrb- kim -rrb- begins to overplay the shock tactics and bait-and-tackle metaphors , you may decide it 's too high a price to pay for a shimmering picture postcard .	once -lrb- You may decide that it's too much of a price for a shiny postcard, but it's worth it.	0	1
Failed	-lrb- t -rrb- his beguiling belgian fable , very much its own droll and delicate little film , has some touching things to say about what is important in life and why .	-lrb- t -rrb- his beguiling belgian fable , very much its own droll and delicate little film , has some touching things to say about what is important in life and why .	1	1
Failed	too often , the viewer is n't reacting to humor so much as they are wincing back in repugnance .	too often , the viewer is n't reacting to humor so much as they are wincing back in repugnance .	0	0
Failed	it 's refreshing to see a girl-power movie that does n't feel it has to prove anything .	it 's refreshing to see a girl-power movie that does n't feel it has to prove anything .	1	1
Failed	bogdanovich tantalizes by offering a peep show into the lives of the era 's creme de la celluloid .	bogdanovich tantalizes by offering a peep show into the lives of the era 's creme de la celluloid .	1	1
Successful	it 's a cookie-cutter movie , a cut-and-paste job .	it's a cookie-cutter movie, just like the one we used to do.	0	1
Failed	it 's a grab bag of genres that do n't add up to a whole lot of sense .	it 's a grab bag of genres that do n't add up to a whole lot of sense .	0	0
Failed	fun , flip and terribly hip bit of cinematic entertainment .	fun , flip and terribly hip bit of cinematic entertainment .	1	1
Failed	just one bad idea after another .	just one bad idea after another .	0	0
Failed	it 's a lovely film with lovely performances by buy and accorsi .	it 's a lovely film with lovely performances by buy and accorsi .	1	1
Successful	the script kicks in , and mr. hartley 's distended pace and foot-dragging rhythms follow .	the script is triggered, and Mr. Hartley's giant strides and low-foot-stepping are heard.	0	1
Failed	does little more than play an innocuous game of fill-in - the-blanks with a tragic past .	does little more than play an innocuous game of fill-in - the-blanks with a tragic past .	0	0
Successful	a hamfisted romantic comedy that makes our girl the hapless facilitator of an extended cheap shot across the mason-dixon line .	a fun-loving romantic comedy that's gonna get our girl the hooker and a brief shot across the wall of the brick wall.	0	1
Successful	like watching a dress rehearsal the week before the show goes up : everything 's in place but something 's just a little off-kilter .	everything is perfectly set up for the week before the show, and everything is perfectly fine.	0	1
Successful	it 's a buggy drag .	it's a car chase.	0	1
Failed	yakusho and shimizu ... create engaging characterizations in imamura 's lively and enjoyable cultural mix .	yakusho and shimizu ... create engaging characterizations in imamura 's lively and enjoyable cultural mix .	1	1
Failed	it 's a bad thing when a movie has about as much substance as its end credits blooper reel .	it 's a bad thing when a movie has about as much substance as its end credits blooper reel .	0	0
Failed	there is nothing outstanding about this film , but it is good enough and will likely be appreciated most by sailors and folks who know their way around a submarine .	there is nothing outstanding about this film , but it is good enough and will likely be appreciated most by sailors and folks who know their way around a submarine .	1	1
Successful	a synthesis of cliches and absurdities that seems positively decadent in its cinematic flash and emptiness .	the films of cinematic distortion and bleakness that seem positively decadent in the movie's structure and bleakness.	0	1
Successful	very special effects , brilliantly bold colors and heightened reality ca n't hide the giant achilles ' heel in `` stuart little 2 `` : there 's just no story , folks .	"the giant achilles heel in `` Stuart Little 2"" is not hiding any of the wonderful effects, amazing colors and fantastic reality."	0	1
Successful	manages to show life in all of its banality when the intention is quite the opposite .	when the intention is to be contrary, he can show the life of all of it.	0	1
Successful	it 's about following your dreams , no matter what your parents think .	it's about the dream, no matter what your parents think.	1	0
Failed	the very definition of the ` small ' movie , but it is a good stepping stone for director sprecher .	the very definition of the ` small ' movie , but it is a good stepping stone for director sprecher .	1	1
Failed	one from the heart .	one from the heart .	1	1
Failed	and when you 're talking about a slapstick comedy , that 's a pretty big problem .	and when you 're talking about a slapstick comedy , that 's a pretty big problem .	0	0
Failed	this is so bad .	this is so bad .	0	0
Failed	so devoid of any kind of intelligible story that it makes films like xxx and collateral damage seem like thoughtful treatises	so devoid of any kind of intelligible story that it makes films like xxx and collateral damage seem like thoughtful treatises	0	0
Successful	ahhhh ... revenge is sweet !	oh, my God...... it's a shame!	1	0
Successful	against all odds in heaven and hell , it creeped me out just fine .	it was against all odds and I was scared to death.	1	0
Failed	the entire movie is about a boring , sad man being boring and sad .	the entire movie is about a boring , sad man being boring and sad .	0	0
Successful	it 's one heck of a character study -- not of hearst or davies but of the unique relationship between them .	it's a study of a unique relationship between hearst and davies, not like the relationship between them.	1	0
Successful	the structure the film takes may find matt damon and ben affleck once again looking for residuals as this officially completes a good will hunting trilogy that was never planned .	as this film officially ends the hunt for the outstanding documentary, Ben Affleck and Matt Damon look to gain more money for the film.	1	0
Failed	whether writer-director anne fontaine 's film is a ghost story , an account of a nervous breakdown , a trip down memory lane , all three or none of the above , it is as seductive as it is haunting .	whether writer-director anne fontaine 's film is a ghost story , an account of a nervous breakdown , a trip down memory lane , all three or none of the above , it is as seductive as it is haunting .	1	1
Successful	the man from elysian fields is a cold , bliss-less work that groans along thinking itself some important comment on how life throws us some beguiling curves .	the man from Elysian Fields is a cold, despairing job that gnaws on him as a thought of how life is terribly twisted, but he will find a perfect comment on how life can bring	0	1
Failed	the draw -lrb- for `` big bad love '' -rrb- is a solid performance by arliss howard .	the draw -lrb- for `` big bad love '' -rrb- is a solid performance by arliss howard .	1	1
Successful	one of the more irritating cartoons you will see this , or any , year .	you'll see a few more of these cartoons, or any year.	0	1
Failed	basically a static series of semi-improvised -lrb- and semi-coherent -rrb- raps between the stars .	basically a static series of semi-improvised -lrb- and semi-coherent -rrb- raps between the stars .	0	0
Successful	for all its technical virtuosity , the film is so mired in juvenile and near-xenophobic pedagogy that it 's enough to make one pine for the day when godard can no longer handle the rigors of filmmaking .	the film is a reminder of the brutal reality of filmmaking, which is more than enough to make one pine for the day when Godard's film becomes obsolete.	0	1
Failed	a very long movie , dull in stretches , with entirely too much focus on meal preparation and igloo construction .	a very long movie , dull in stretches , with entirely too much focus on meal preparation and igloo construction .	0	0
Successful	there is very little dread or apprehension , and though i like the creepy ideas , they are not executed with anything more than perfunctory skill .	it's not a big scare or dread, and I'm not afraid of anything more than simple skills.	0	1
Successful	it 's fun lite .	it's a little bit of a game.	1	0
Failed	a big , gorgeous , sprawling swashbuckler that delivers its diversions in grand , uncomplicated fashion .	a big , gorgeous , sprawling swashbuckler that delivers its diversions in grand , uncomplicated fashion .	1	1
Successful	the overall effect is less like a children 's movie than a recruitment film for future hollywood sellouts .	the overall effect is much like a kid's movie, and that's why it's like a movie to young Hollywood.	0	1
Failed	trite , banal , cliched , mostly inoffensive .	trite , banal , cliched , mostly inoffensive .	0	0
Successful	so much facile technique , such cute ideas , so little movie .	there's so much cheap, such cute ideas, so little movie.	1	0
Failed	chilling , well-acted , and finely directed : david jacobson 's dahmer .	chilling , well-acted , and finely directed : david jacobson 's dahmer .	1	1
Successful	visually rather stunning , but ultimately a handsome-looking bore , the true creativity would have been to hide treasure planet entirely and completely reimagine it .	the beauty of the picture, but it's actually a pretty bad-looking monster, and that's why he's actually a great, really beautiful piece of work.	0	1
Successful	a movie that successfully crushes a best selling novel into a timeframe that mandates that you avoid the godzilla sized soda .	the film that's destroying a bestseller's bestseller, so that you don't want to be with Godzilla.	1	0
Successful	once the 50 year old benigni appears as the title character , we find ourselves longing for the block of wood to come back .	when we see the 50-year-old benigni as the lead character, we feel like returning the block of wood.	0	1
Successful	but taken as a stylish and energetic one-shot , the queen of the damned can not be said to suck .	she can't be said to suck in the style and energy of the damned.	1	0
Successful	at least one scene is so disgusting that viewers may be hard pressed to retain their lunch .	it's enough to scare the viewers into a lunge.	0	1
Failed	the movie has an infectious exuberance that will engage anyone with a passing interest in the skate\/surf culture , the l.a. beach scene and the imaginative -lrb- and sometimes illegal -rrb- ways kids can make a playground out of the refuse of adults .	the movie has an infectious exuberance that will engage anyone with a passing interest in the skate\/surf culture , the l.a. beach scene and the imaginative -lrb- and sometimes illegal -rrb- ways kids can make a playground out of the refuse of adults .	1	1
Successful	corpus collosum -- while undeniably interesting -- wore out its welcome well before the end credits rolled about 45 minutes in .	the way the movie was released in 45 minutes, it was clear that the finale was a little boring, but then it was a good time.	0	1
Failed	this illuminating documentary transcends our preconceived vision of the holy land and its inhabitants , revealing the human complexities beneath .	this illuminating documentary transcends our preconceived vision of the holy land and its inhabitants , revealing the human complexities beneath .	1	1
Successful	trademark american triteness and simplicity are tossed out the window with the intelligent french drama that deftly explores the difficult relationship between a father and son .	the elegant French drama of John and the son of a father is brought down by the unruly American identity and its natural simplicity.	1	0
Successful	villeneuve spends too much time wallowing in bibi 's generic angst -lrb- there are a lot of shots of her gazing out windows -rrb- .	there are a lot of shots of villeneuve, looking out the window -rrb- - in the background.	0	1
Successful	what is 100 % missing here is a script of even the most elemental literacy , an inkling of genuine wit , and anything resembling acting .	it's 100% missing, but it's got an almost elemental literacy, an inkling of real wit and almost anything resembling acting.	0	1
Failed	as the two leads , lathan and diggs are charming and have chemistry both as friends and lovers .	as the two leads , lathan and diggs are charming and have chemistry both as friends and lovers .	1	1
Successful	like leon , it 's frustrating and still oddly likable .	as much as Leo, it's frustrating and awkward.	1	0
Successful	if you can stomach the rough content , it 's worth checking out for the performances alone .	if you're interested in the performance, you can go through the rough content yourself.	1	0
Failed	there 's really only one good idea in this movie , but the director runs with it and presents it with an unforgettable visual panache .	there 's really only one good idea in this movie , but the director runs with it and presents it with an unforgettable visual panache .	1	1
Successful	and that leaves a hole in the center of the salton sea .	that's where the sea goes to the center of the sea.	0	1
Failed	there 's ... tremendous energy from the cast , a sense of playfulness and excitement that seems appropriate .	there 's ... tremendous energy from the cast , a sense of playfulness and excitement that seems appropriate .	1	1
Failed	director andrew niccol ... demonstrates a wry understanding of the quirks of fame .	director andrew niccol ... demonstrates a wry understanding of the quirks of fame .	1	1
Successful	try as i may , i ca n't think of a single good reason to see this movie , even though everyone in my group extemporaneously shouted , ` thank you ! '	"even though everyone in my group has known, "" Thank you!"""	0	1
Failed	shaky close-ups of turkey-on-rolls , stubbly chins , liver spots , red noses and the filmmakers new bobbed do draw easy chuckles but lead nowhere .	shaky close-ups of turkey-on-rolls , stubbly chins , liver spots , red noses and the filmmakers new bobbed do draw easy chuckles but lead nowhere .	0	0
Successful	utterly lacking in charm , wit and invention , roberto benigni 's pinocchio is an astonishingly bad film .	even though roberto benigni's pinocchio is a stunningly bad movie, he is a remarkable and utterly uncharismatic film.	0	1
Failed	further proof that the epicenter of cool , beautiful , thought-provoking foreign cinema is smack-dab in the middle of dubya 's axis of evil .	further proof that the epicenter of cool , beautiful , thought-provoking foreign cinema is smack-dab in the middle of dubya 's axis of evil .	1	1
Failed	but what are adults doing in the theater at all ?	but what are adults doing in the theater at all ?	0	0
Successful	miller is playing so free with emotions , and the fact that children are hostages to fortune , that he makes the audience hostage to his swaggering affectation of seriousness .	miller is playing so free with emotions and the fact that children are being kidnapped by fortune, he's making the audience feel like a hostage to his lippiness.	1	0
Failed	the piece plays as well as it does thanks in large measure to anspaugh 's three lead actresses .	the piece plays as well as it does thanks in large measure to anspaugh 's three lead actresses .	1	1
Successful	what better message than ` love thyself ' could young women of any size receive ?	"young women of all sizes would be better equipped with a message of ""love yourself."""	1	0
Failed	if you enjoy more thoughtful comedies with interesting conflicted characters ; this one is for you .	if you enjoy more thoughtful comedies with interesting conflicted characters ; this one is for you .	1	1
Failed	it 's like every bad idea that 's ever gone into an after-school special compiled in one place , minus those daytime programs ' slickness and sophistication -lrb- and who knew they even had any ? -rrb- .	it 's like every bad idea that 's ever gone into an after-school special compiled in one place , minus those daytime programs ' slickness and sophistication -lrb- and who knew they even had any ? -rrb- .	0	0
Failed	the movie is beautiful to behold and engages one in a sense of epic struggle -- inner and outer -- that 's all too rare in hollywood 's hastier productions .	the movie is beautiful to behold and engages one in a sense of epic struggle -- inner and outer -- that 's all too rare in hollywood 's hastier productions .	1	1
Failed	there 's not enough here to justify the almost two hours .	there 's not enough here to justify the almost two hours .	0	0
Successful	although huppert 's intensity and focus has a raw exhilaration about it , the piano teacher is anything but fun .	however, the piano teacher is completely unkind to the piano teacher, and the piano teacher has a raw excitement about him.	0	1
Successful	nothing is sacred in this gut-buster .	there's nothing sacred about the gut-buster.	0	1
Successful	a tender , heartfelt family drama .	a wishlist, a sad family drama.	1	0
Failed	... nothing scary here except for some awful acting and lame special effects .	... nothing scary here except for some awful acting and lame special effects .	0	0
Successful	it made me want to wrench my eyes out of my head and toss them at the screen .	I wanted to throw my eyes out of my head and look on the screen.	0	1
